title,url,search_keyword,press,date,content,company,source_type,source_platform,collected_at
"링글, '링글3.0' 공개…신규 서비스로 학습 효과 극대화",http://www.m-i.kr/news/articleView.html?idxno=1078243,링글,매일일보,2023-12-22T07:23:06+09:00,"링글 AI 분석 정식 서비스와 학습 메뉴 신설 링글은 학습자 중심으로 서비스 전반을 개편한 ‘링글 3.0’을 공개했다. 사진=링글 제공 매일일보 = 김혜나 기자 | 링글은 학습자 중심으로 서비스 전반을 개편한 ‘링글 3.0’을 공개했다고 21일 밝혔다. 이번 개편으로 링글은 △링글 AI 분석 △매일 학습 거리 △커리어 관련 웨비나 등을 서비스하고 학습 효과 극대화에 나선다. 우선 신규 서비스로 영어 학습 효과를 높인다. 링글은 자체 데이터로 개발한 링글 AI 분석을 링글 3.0에 정식 서비스한다. 학습자가 화상 수업 중 얘기한 모든 내용을 인공지능(AI)으로 분석·평가하는 서비스다. 학습자에게 △어휘와 문장의 난이도 △문법 정확성 △유창성 △발음 네 가지 분야별 점수와 문장 단위의 상세 피드백을 제공한다. 이를 통해 학습자는 본인의 영어 실력과 개선점을 정확하게 파악하고 학습에 따른 실력 변화를 추적할 수 있다. 링글은 매일 간편하게 영어를 공부할 수 있는 학습 메뉴를 신설했다. 학습자는 학습 메뉴에서 △맞는 문장 고르기 △소리 내 읽고 발음 교정하기 △빈칸 채우기 등을 통해 한국인이 가장 많이 지적받는 영어 실수와 쓰임이 많은 영어 표현을 꾸준히 학습할 수 있다. 링글은 영어 공부 동기부여를 위한 서비스도 강화한다. 링글은 이벤트 메뉴에서 △영문 이력서 작성법 △영어 인터뷰 준비 방법 △해외 진학이나 취업 노하우 △영어 발표 및 미팅 잘하는 법 등 커리어나 비즈니스 영어 관련 온·오프라인 세미나와 유수 기업·기관에 재직 중인 링글 회원 간 네트워킹 행사를 제공할 예정이다. 학습자는 이벤트 메뉴를 통해 링글에서 운영하는 챌린지나 스스로 목표를 설정한 챌린지에 참여하고 추가 수업권, 링글 포인트 등 보상과 목표 달성을 기념하는 배지를 받을 수 있다. 전반적인 사용자 편의성도 개선했다. 학습자가 최소한의 클릭으로 수업을 예약하고 학습에 집중할 수 있도록 예약 과정 간소화와 홈 화면 개편을 진행했다. 수업 예약 후 교재를 여유롭게 선택할 수 있도록 시스템을 바꾸고, 레벨에 따른 교재 분류를 제공해 교재 선택 용이성을 높였다. 체계적인 학습을 위해 수업 준비 단계에서 지난 수업 후 받은 튜터 피드백과 주요 인공지능(AI) 분석 내용도 제공한다. 이승훈 링글 공동대표는 “이번 개편을 통해 링글은 이용자가 일대일 수업 외에도 매일 영어공부를 할 수 있는 신규 콘텐츠와 수업 전후로 자신의 영어 실력 변화를 세밀하고 정확하게 파악해 체계적으로 학습할 수 있는 발전된 서비스를 제공하고자 한다”며 “링글은 앞으로도 고객의 소중한 의견을 수렴하고 더 나은 학습 경험을 제공하기 위해 지속적으로 서비스를 개선해 나갈 것”이라고 말했다. 저작권자 © 매일일보 무단전재 및 재배포 금지 트윗하기 김혜나 기자 hnkim@m-i.kr 다른기사 보기 페이스북 트위터 카카오스토리 기사공유하기",Ringle,news,Naver News,2026-01-18 10:03:23
"링글, 학습자 중심 서비스 ‘링글3.0’ 공개",https://www.mk.co.kr/article/10903895,링글,매일경제,2023-12-21T14:45:11+09:00,,Ringle,news,Naver News,2026-01-18 10:03:23
"링글, 학습자 중심 서비스 개편… ""학습 효과 극대화”",https://zdnet.co.kr/view/?no=20231221145945,링글,,2023-12-21T14:59:45+09:00,"디지털 기반 종합 영어회화 솔루션 링글(공동대표 이승훈, 이성파)은 학습자 중심으로 서비스 전반을 개편한 ‘링글 3.0’을 공개했다고 21일 밝혔다. 이번 개편으로 링글은 ▲링글 AI 분석 ▲매일 학습 거리 ▲커리어 관련 웨비나 등을 서비스하고 학습 효과 극대화에 나선다. 우선 링글은 신규 서비스로 영어 학습 효과를 높인다. 링글은 자체 데이터로 개발한 링글 AI 분석을 링글 3.0에 정식 서비스한다. 이는 학습자가 화상 수업 중 얘기한 모든 내용을 인공지능(AI)으로 분석·평가하는 서비스로 학습자에게 ▲어휘와 문장의 난이도 ▲문법 정확성 ▲유창성 ▲발음 네 가지 분야별 점수와 문장 단위의 상세 피드백을 제공한다. 이를 통해 학습자는 본인의 영어 실력과 개선점을 정확하게 파악하고 학습에 따른 실력 변화를 추적할 수 있다. 링글 3.0 또 링글은 매일 간편하게 영어를 공부할 수 있는 학습 메뉴를 신설했다. 학습자는 학습 메뉴에서 ▲맞는 문장 고르기 ▲소리 내 읽고 발음 교정하기 ▲빈칸 채우기 등을 통해 한국인이 가장 많이 지적받는 영어 실수와 쓰임이 많은 영어 표현을 꾸준히 학습할 수 있다. 링글은 영어 공부 동기부여를 위한 서비스도 강화한다. 링글은 이벤트 메뉴에서 ▲영문 이력서 작성법 ▲영어 인터뷰 준비 방법 ▲해외 진학이나 취업 노하우 ▲영어 발표 및 미팅 잘하는 법 등 커리어나 비즈니스 영어 관련 온·오프라인 세미나와 유수 기업·기관에 재직 중인 링글 회원 간 네트워킹 행사를 제공할 예정이다. 또 학습자는 이벤트 메뉴를 통해 링글에서 운영하는 챌린지나 스스로 목표를 설정한 챌린지에 참여하고 추가 수업권, 링글 포인트 등 보상과 목표 달성을 기념하는 배지를 받을 수 있다. 관련기사 [영상] 세상에서 제일 따뜻한 전시회 2023.11.30 [영상] MZ세대 기자들의 '인생네컷' 2023.07.11 [영상] IT기자들의 연기 도전...‘뉴연플리’ 오디션에 가다 2022.07.05 [영상] 천생 기자들의 스우파 ‘헤이마마’ 댄스 도전기 2022.02.20 이외에도 링글은 전반적인 사용자 편의성을 개선했다. 학습자가 최소한의 클릭으로 수업을 예약하고 학습에 집중할 수 있도록 예약 과정 간소화와 홈 화면 개편을 진행했다. 또한 수업 예약 후 교재를 여유롭게 선택할 수 있도록 시스템을 바꾸고 레벨에 따른 교재 분류를 제공해 교재 선택 용이성을 높였다. 체계적인 학습을 위해 수업 준비 단계에서 지난 수업 후 받은 튜터 피드백과 주요 AI 분석 내용도 제공한다. 이승훈 링글 공동대표는 “이번 개편을 통해 링글은 이용자가 일대일 수업 외에도 매일 영어공부를 할 수 있는 신규 콘텐츠와 수업 전후로 자신의 영어 실력 변화를 세밀하고 정확하게 파악해 체계적으로 학습할 수 있는 발전된 서비스를 제공하고자 한다”며 “링글은 앞으로도 고객의 소중한 의견을 수렴하고 더 나은 학습 경험을 제공하기 위해 지속적으로 서비스를 개선해 나갈 것”이라고 밝혔다.",Ringle,news,Naver News,2026-01-18 10:03:23
"링글, 학습자 중심 서비스 '링글3.0' 공개…학습 효과 '극대화'",https://www.datanet.co.kr/news/articleView.html?idxno=189800,링글,데이터넷,2023-12-21T10:25:58+09:00,"링글 AI 분석 정식 서비스와 학습 메뉴 신설 더 나은 학습 경험 제공 위해 서비스 지속 개선 [데이터넷] 디지털 기반 종합 영어회화 솔루션 링글(공동대표 이승훈·이성파)은 학습자 중심으로 서비스 전반을 개편한 ‘링글 3.0’을 공개했다고 밝혔다. 이번 개편으로 링글은 ▲링글 AI 분석 ▲매일 학습 거리 ▲커리어 관련 웨비나 등을 서비스하고 학습 효과 극대화에 나선다. 링글은 신규 서비스로 영어 학습 효과를 높인다. 링글은 자체 데이터로 개발한 링글 AI 분석을 링글 3.0에 정식 서비스한다. 이는 학습자가 화상 수업 중 얘기한 모든 내용을 AI로 분석·평가하는 서비스로 학습자에게 ▲어휘와 문장의 난이도 ▲문법 정확성 ▲유창성 ▲발음 네 가지 분야별 점수와 문장 단위의 상세 피드백을 제공한다. 이를 통해 학습자는 본인의 영어 실력과 개선점을 정확하게 파악하고 학습에 따른 실력 변화를 추적할 수 있다. 또한 매일 간편하게 영어를 공부할 수 있는 학습 메뉴를 신설했다. 학습자는 학습 메뉴에서 ▲맞는 문장 고르기 ▲소리 내 읽고 발음 교정하기 ▲빈칸 채우기 등을 통해 한국인이 가장 많이 지적받는 영어 실수와 쓰임이 많은 영어 표현을 꾸준히 학습할 수 있다. 링글은 영어 공부 동기부여를 위한 서비스도 강화한다. 링글은 이벤트 메뉴에서 ▲영문 이력서 작성법 ▲영어 인터뷰 준비 방법 ▲해외 진학이나 취업 노하우 ▲영어 발표 및 미팅 잘하는 법 등 커리어나 비즈니스 영어 관련 온·오프라인 세미나와 유수 기업·기관에 재직 중인 링글 회원 간 네트워킹 행사를 제공할 예정이다. 또한 학습자는 이벤트 메뉴를 통해 링글에서 운영하는 챌린지나 스스로 목표를 설정한 챌린지에 참여하고 추가 수업권, 링글 포인트 등 보상과 목표 달성을 기념하는 배지를 받을 수 있다. 이외에도 전반적인 사용자 편의성도 개선됐다. 학습자가 최소한의 클릭으로 수업을 예약하고 학습에 집중할 수 있도록 예약 과정 간소화와 홈 화면 개편을 진행했다. 또한 수업 예약 후 교재를 여유롭게 선택할 수 있도록 시스템을 바꾸고 레벨에 따른 교재 분류를 제공해 교재 선택 용이성을 높였다. 체계적인 학습을 위해 수업 준비 단계에서 지난 수업 후 받은 튜터 피드백과 주요 AI 분석 내용도 제공한다. 이승훈 링글 공동대표는 “이번 개편을 통해 링글은 이용자가 일대일 수업 외에도 매일 영어공부를 할 수 있는 신규 콘텐츠와 수업 전후로 자신의 영어 실력 변화를 세밀하고 정확하게 파악해 체계적으로 학습할 수 있는 발전된 서비스를 제공하고자 한다”며 “링글은 앞으로도 고객의 소중한 의견을 수렴하고 더 나은 학습 경험을 제공하기 위해 지속적으로 서비스를 개선해 나갈 것”이라고 밝혔다. 저작권자 © 데이터넷 무단전재 및 재배포 금지 강석오 기자 다른기사 보기 페이스북 트위터 카카오스토리 URL복사 기사공유하기",Ringle,news,Naver News,2026-01-18 10:03:23
"링글, 학습자 중심 서비스 '링글3.0' 공개",https://www.etnews.com/20231221000306,링글,미래를 보는 창 - 전자신문,2023-12-21T14:08:57+09:00,"링글 3.0 서비스 이미지 디지털 영어회화 솔루션 링글이 학습자 중심으로 서비스 전반을 개편한 '링글 3.0'을 공개했다. 이번 개편으로 링글은 △링글 인공지능(AI) 분석 △매일 학습 거리 △커리어 관련 웨비나 등을 서비스하고 학습 효과 극대화에 나선다. 우선 학습자가 화상 수업 중 얘기한 모든 내용을 AI으로 분석·평가하는 서비스를 제공한다. 어휘와 문장의 난이도, 문법 정확성, 유창성, 발음 4가지 분야별 점수와 문장 단위의 상세 피드백을 제공한다. 이를 통해 학습자는 본인의 영어 실력과 개선점을 정확하게 파악하고 학습에 따른 실력 변화를 추적할 수 있다. 또 매일 간편하게 영어를 공부할 수 있는 학습 메뉴를 신설했다. '맞는 문장 고르기', '소리내 읽고 발음 교정하기' 등 한국인이 가장 많이 지적받는 영어 실수와 쓰임이 많은 영어 표현을 꾸준히 학습할 수 있다. 링글은 영어 공부 동기부여를 위한 서비스도 강화한다. 이벤트 메뉴에서 영문 이력서 작성법이나 영어 인터뷰 준비 방법, 해외 진학이나 취업 노하우 등 관련 세미나나 네트워킹 행사를 제공할 예정이다. 학습자는 이벤트 메뉴를 통해 링글에서 운영하는 챌린지나 스스로 목표를 설정한 챌린지에 참여하고 추가 수업권, 링글 포인트 등 보상과 목표 달성을 기념하는 배지를 받을 수 있다. 이외에도 학습자가 최소한의 클릭으로 수업을 예약하고 학습에 집중할 수 있도록 예약 과정 간소화와 홈 화면 개편을 진행했다. 이승훈 링글 공동대표는 “링글은 이용자가 일대일 수업 외에도 매일 영어공부를 할 수 있는 신규 콘텐츠와 수업 전후로 자신의 영어 실력 변화를 세밀하고 정확하게 파악해 체계적으로 학습할 수 있는 발전된 서비스를 제공하고자 한다”고 밝혔다. 김명희 기자 noprint@etnews.com",Ringle,news,Naver News,2026-01-18 10:03:23
"“튜터와의 대화에 ‘더’ 집중하세요”링글, AI 진단 툴 개발",https://www.mk.co.kr/article/10886377,링글,매일경제,2023-12-05T08:00:00+09:00,,Ringle,news,Naver News,2026-01-18 10:03:23
"""링글은 AI가 영어실력 알려줘요""",https://www.mk.co.kr/article/10890316,링글,매일경제,2023-12-04T16:09:44+09:00,,Ringle,news,Naver News,2026-01-18 10:03:23
K글로벌@실리콘밸리 2024 성료.. 피칭대회서링글1등상 수상,https://www.mk.co.kr/article/11127304,링글,매일경제,2024-09-28T03:30:56+09:00,,Ringle,news,Naver News,2026-01-18 10:03:23
"채널톡, ‘링글’에 서비스 공급",https://www.venturesquare.net/903073,링글,벤처스퀘어,2023-11-15T02:58:34+09:00,"채널톡, ‘링글’에 서비스 공급 오효진 2023년 11월 15일 올인원 비즈니스 메신저 ‘채널톡’ 을 운영하고 있는 (주)채널코퍼레이션(공동대표 최시원·김재홍)은 디지털 기반 종합 영어회화 솔루션 ‘링글’이 채널톡을 도입했다고 15일 밝혔다. 2015년에 설립된 링글은 전 세계 1만5000여 명의 사용자들과 1900여 명의 튜터들이 사용하는 화상 영어 서비스다. 회화 실력 향상에 어려움을 겪는 10대와 성인들을 대상으로 아이비리그 출신 원어민 튜터의 1:1 비대면 영어 수업부터 인공지능(AI) 진단, 자체 맞춤형 교재 등 종합 영어회화 솔루션을 제공하고 있다. 채널코퍼레이션은 링글에 언어 장벽과 시차에 상관없이 상담 서비스를 제공하는 글로벌 제품인 채널톡을 공급하게 됐다. 자주 묻는 질문들을 한국어, 영어, 일본어, 중국어 챗봇으로 자동화하고 추가 상담이 필요한 경우에는 고객 정보를 연동해 상담원들이 고객 맞춤형 상담이 가능하도록 했다. 더불어 카카오, 이메일 등 여러 상담 채널을 하나의 창구로 일원화했다. 해외에 거주하고 있는 튜터들과 주고받는 이메일도 채널톡 내에서 회신할 수 있어 효율적인 상담 환경을 구축했다. 이승훈 링글 공동대표는 “전 세계 이용자들이 쉽고 편하게 상담 받을 수 있는 환경을 구축하고자 채널톡을 도입했다”며 “챗봇으로 시간과 장소에 구애없이 24시간 응대가 가능해지고, 다수의 채널을 통해 들어오던 고객 문의를 한 솔루션 내에서 관리할 수 있어 CS 효율이 향상될 것으로 기대한다”고 말했다. 최시원 채널코퍼레이션 대표는 “상담원이 학습자의 데이터를 채널톡으로 확인하고 개개인에게 최적화된 상담을 진행할 수 있어 고객 만족도가 높아질 것”며 “앞으로도 AI 기술을 기반으로 제품 및 서비스를 고도화해 다양한 글로벌 기업에서 활용할 수 있는 비즈니스 툴로 자리매김하겠다”고 말했다. 한편 채널톡은 채팅·챗봇·이메일 상담, CRM 마케팅, 팀 메신저, AI 인터넷 전화 등을 하나로 통합한 올인원 비즈니스 솔루션으로 전 세계 22개국에 걸쳐 스타트업부터 중견·중소기업(SMB), 대기업까지 약 15만여 기업이 사용 중에 있으며, 매출의 25%가 해외에서 발생하고 있다. 관련 기사 더 보기 채널톡 운영 ‘채널코퍼레이션’, AI팀 신설 Facebook Twitter LinkedIn Print Like this: Like Loading... Related 도입 링글 비즈니스 메신저 채널코퍼레이션 채널톡 Facebook Twitter LinkedIn Print Like this: Like Loading... Related",Ringle,news,Naver News,2026-01-18 10:03:23
"채널톡, ‘링글’에 서비스 공급…글로벌 유저 상담 최적화",https://www.etoday.co.kr/news/view/2302513,링글,이투데이,2023-11-15T10:36:00+09:00,,Ringle,news,Naver News,2026-01-18 10:03:23
"채널코퍼레이션, '링글'에 서비스 공급",https://zdnet.co.kr/view/?no=20231115124756,링글,,2023-11-15T13:24:09+09:00,"올인원 비즈니스 메신저 채널톡 운영사 채널코퍼레이션은 디지털 기반 종합 영어회화 솔루션 링글이 채널톡을 도입했다고 15일 밝혔다. 2015년 설립된 링글은 전 세계 1만5천여명의 이용자들과 1천900여명 튜터들이 사용하는 화상 영어 서비스다. 회화 실력 향상에 어려움을 겪는 10대와 성인들을 대상으로 아이비리그 출신 원어민 튜터의 1대1 비대면 영어 수업부터 인공지능(AI) 진단, 자체 맞춤형 교재 등 종합 영어회화 솔루션을 제공하고 있다. 채널코퍼레이션은 링글에 언어 장벽과 시차에 상관없이 상담 서비스를 제공하는 글로벌 제품인 채널톡을 공급하게 됐다. 자주 묻는 질문들을 한국어, 영어, 일본어, 중국어 챗봇으로 자동화하고 추가 상담이 필요한 경우에는 고객 정보를 연동해 상담원들이 고객 맞춤형 상담이 가능하도록 했다. (사진=채널코퍼레이션) 아울러 카카오, 이메일 등 여러 상담 채널을 하나의 창구로 일원화했다. 해외에 거주하고 있는 튜터들과 주고받는 이메일도 채널톡 내에서 회신할 수 있어 효율적인 상담 환경을 구축했다. 관련기사 채널코퍼레이션, ‘고객경험’ 나아갈 방향 제시한다 2023.11.10 채널톡, 고객 편의성 개선...""정교한 마케팅 가능해져” 2023.11.01 채널코퍼레이션, 신입사원 채용설명회 11월7일 진행 2023.10.27 채널코퍼레이션-CS쉐어링, AI고객센터 솔루션 만든다 2023.10.24 이승훈 링글 공동대표는 “전 세계 이용자들이 쉽고 편하게 상담 받을 수 있는 환경을 구축하고자 채널톡을 도입했다”며 “챗봇으로 시간과 장소에 구애없이 24시간 응대가 가능해지고, 다수 채널을 통해 들어오던 고객 문의를 한 솔루션 내에서 관리할 수 있어 CS  효율이 향상될 것으로 기대한다”고 말했다. 최시원 채널코퍼레이션 대표는 “상담원이 학습자의 데이터를 채널톡으로 확인하고 개개인에게 최적화된 상담을 진행할 수 있어 고객 만족도가 높아질 것”며 “앞으로도 AI 기술을 기반으로 제품 및 서비스를 고도화해 다양한 글로벌 기업에서 활용할 수 있는 비즈니스 툴로 자리매김하겠다”고 말했다.",Ringle,news,Naver News,2026-01-18 10:03:23
"링글, '채널톡' 도입으로 쉽고 편한 상담 환경 구현",https://www.datanet.co.kr/news/articleView.html?idxno=188783,링글,데이터넷,2023-11-15T18:59:10+09:00,"언어와 시차 상관없이 챗봇으로 실시간 응대 가능 고객 정보 연동, 학습자 교육 데이터 토대로 맞춤형 상담 지원 [데이터넷] 채널코퍼레이션(공동대표 최시원·김재홍)은 디지털 기반 종합 영어회화 솔루션 ‘링글’이 올인원 비즈니스 메신저 ‘채널톡’을 도입했다고 밝혔다. 링글은 전 세계 1만5000여 명의 사용자들과 1900여 명의 튜터들이 사용하는 디지털 기반 종합 영어회화 솔루션이다. 회화 실력 향상에 어려움을 겪는 10대와 성인들을 대상으로 아이비리그 출신 원어민 튜터의 1:1 비대면 영어 수업부터 인공지능(AI) 진단, 자체 맞춤형 교재 등 종합 솔루션을 제공하고 있다. 링글은 언어 장벽과 시차에 상관없이 상담 서비스를 제공하는 채널톡을 통해 자주 묻는 질문들은 한국어, 영어, 일본어, 중국어 챗봇으로 자동화하고, 추가 상담이 필요하면 고객 정보를 연동해 상담원들이 고객 맞춤형 상담이 가능하도록 했다. 더불어 카카오, 이메일 등 여러 채널을 하나의 창구로 일원화하고, 해외에 거주하는 튜터들과 주고받는 이메일도 채널톡 내에서 회신할 수 있도록 효율적인 상담 환경을 구현했다. 이승훈 링글 공동대표는 “전 세계 이용자들이 쉽고 편하게 상담 받을 수 있는 환경을 구축하고자 채널톡을 도입했다”며 “챗봇으로 시간과 장소에 구애없이 24시간 응대가 가능하고, 다수의 채널을 통해 들어오던 문의를 한 솔루션으로 관리할 수 있어 CS 효율이 향상될 것”이라고 기대했다. 최시원 채널코퍼레이션 대표는 “상담원이 학습자의 데이터를 채널톡으로 확인하고 개개인에게 최적화된 상담을 진행할 수 있어 고객 만족도가 높아질 것”며 “AI 기술을 기반으로 제품 및 서비스를 고도화해 다양한 글로벌 기업에서 활용할 수 있는 비즈니스 툴로 자리매김하겠다”고 강조했다. 저작권자 © 데이터넷 무단전재 및 재배포 금지 강석오 기자 다른기사 보기 페이스북 트위터 카카오스토리 URL복사 기사공유하기",Ringle,news,Naver News,2026-01-18 10:03:23
"채널톡 X '링글', 서비스 공급 시작… 글로벌 유저 상담 최적화",https://www.discoverynews.kr/news/articleView.html?idxno=1035926,링글,디스커버리뉴스(DISCOVERYNEWS),2023-11-15T16:51:59+09:00,기자명 정기환 기자 입력 2023.11.15 16:51 댓글 0,Ringle,news,Naver News,2026-01-18 10:03:23
